<?xml version="1.0" encoding="UTF-8"?>
<schema xmlns="http://www.w3.org/2001/XMLSchema"
        targetNamespace="http://gbyzzz.by/task07webxmlparsing/entity/users"
        xmlns:tns="http://gbyzzz.by/task07webxmlparsing/entity/users"
        elementFormDefault="qualified" attributeFormDefault="unqualified">
    <element name = "users" >
        <complexType>
            <choice maxOccurs="unbounded">
                <element name = "user" type="tns:users" maxOccurs="unbounded"/>
                <element name = "admin" type="tns:users" maxOccurs="unbounded"/>
                <element name = "bartender" type="tns:users" maxOccurs="unbounded"/>
            </choice>
        </complexType>
        <unique name="unique-id">
            <selector xpath="user"/>
            <field xpath="@id"/>
        </unique>
        <unique name="unique-email">
            <selector xpath="user"/>
            <field xpath="@email"/>
        </unique>
        <unique name="unique-username">
            <selector xpath="user"/>
            <field xpath="@username"/>
        </unique>
        <unique name="unique-phone">
            <selector xpath="user"/>
            <field xpath="@phone"/>
        </unique>
    </element>
    <complexType name="users">
        <sequence>
            <element name="username">
                <simpleType>
                    <restriction base="string">
                        <pattern value="([a-zA-Z])[a-zA-Z0-9]{3,19}"/>
                    </restriction>
                </simpleType>
            </element>
            <element name="phone" minOccurs="0" >
                <simpleType>
                    <restriction base="string">
                        <minLength value="10"/>
                        <maxLength value="12"/>
                    </restriction>
                </simpleType>
            </element>
            <element name="email">
                <simpleType>
                    <restriction base="string">
                        <pattern value="[^@]+@[^\.]+\..+"/>
                    </restriction>
                </simpleType>
            </element>
            <element name="is_active" type="boolean"/>
            <element name="reg_date" type="date"/>
        </sequence>
        <attribute name="id" type="long" use="required"/>
        <attribute name="name" type="string"/>
        <attribute name="surname" type="string"/>
    </complexType>
</schema>